OBJECTID,COMPKEY,COMPTYPE,SEGKEY,UNITID,UNITTYPE,UNITDESC,MATERIAL,MODEL_TYPE,ASSET_HEIGHT,ASBLT,INSTALL_DATE,COMMENTS,CATEGORY,STYLE,CURRENT_STATUS,CURRENT_STATUS_DATE,CONDITION,CONDITION_ASSESSMENT_DATE,OWNERSHIP,OWNERSHIP_DATE,ADDDTTM,MODDTTM,MAINTAINED_BY,LAST_ASSET_VERIFICATION_DATE,MAINTENANCE_FINANCIAL_RESP,MAINTENANCE_AGREEMENT,PRIMARYDISTRICTCD,SECONDARYDISTRICTCD,OVERRIDEYN,OVERRIDECOMMENT,LOG_COMMENT_1,LOG_COMMENT_2,LOG_COMMENT_3,ATTACHMENT_1,ATTACHMENT_2,ATTACHMENT_3,ATTACHMENT_4,ATTACHMENT_5,ATTACHMENT_6,ATTACHMENT_7,ATTACHMENT_8,ATTACHMENT_9,ATTACHMENT_10,NUM_ATTACHMENTS,DATE_MVW_LAST_UPDATED,SHAPE_Length,SHAPE_Area
1244,764637,16,13337,RRX-085587B,RRX,WEST SEATTLE BR WB BETWEEN I5 NB - W SEATTLE BR RP AND 1ST AV S OFF RP CROSSING 3 TRACKS,RRX-AC/PC,RRX-MAIN,0,,,"EB Spokane; 3 tracks, 4 xbucks facing EB traffic across Spokane, NB traffic on 2nd turning into Spokane EB
Active - gate but no stop bar
ACPC GOOD - no damage to tracks or concrete
Next to underpass but not under it",RRX-ATGRDE,RRX-ACTVE,INSVC,2019/07/24 00:00:00+00,GOOD,2019/07/24 00:00:00+00,BNSF,,2020/05/05 00:00:00+00,,BNSF,,BNSF,,DISTRICT2, ,N,,,,,\\dotnas\InfoPublicSector\H8\PROD\ATTACHMENTS\AM Railroad Crossings\RR_Franchise_Map_Index.pdf,\\dotnas\InfoPublicSector\H8\PROD\ATTACHMENTS\AM Railroad Crossings\Index_to_Permits_Spokane_Ave.pdf,\\dotnas\InfoPublicSector\H8\PROD\ATTACHMENTS\AM Railroad Crossings\RRX_LOU_Xing_Agrmnt_1988.pdf,\\dotnas\InfoPublicSector\H8\PROD\ATTACHMENTS\AM Railroad Crossings\085587B_InspPhotos_20150713.pdf,\\dotnas\InfoPublicSector\H8\PROD\ATTACHMENTS\AM Railroad Crossings\SDOT_SODO_QZ_Diagnostic-1_CityLight_20191211.pdf,\\dotnas\InfoPublicSector\H8\PROD\ATTACHMENTS\AM Railroad Crossings\BNSF_Ordinance_List.pdf,\\dotnas\InfoPublicSector\H8\PROD\ATTACHMENTS\AM Railroad Crossings\NPRR_Ordinance_List.pdf,\\dotnas\InfoPublicSector\H8\PROD\ATTACHMENTS\AM Railroad Crossings\RRX-085587B_InspectRecord_20190724.pdf,,,8,2023/09/26 19:13:07+00,192.064350138212,-2573.60697500519
1245,764638,16,6294,RRX-085588H,RRX,4TH AV S VI BETWEEN 4TH AVE S AND 4TH AVE S CROSSING 1 TRACKS,RRX-BRIDGE,RRX-MAIN,0,,,"4TH Ave Bridge over UPRR Argo Yard; Likely City of Seattle Ownership",RRX-UNDER,RRX-NONE,INSVC,2019/07/25 00:00:00+00,GOOD,2019/07/25 00:00:00+00,MULTIPLE,,2020/05/05 00:00:00+00,,MULTIPLE,,MULTIPLE,,DISTRICT2, ,N,,,,,\\dotnas\InfoPublicSector\H8\PROD\ATTACHMENTS\AM Railroad Crossings\RR_Franchise_Map_Index.pdf,\\dotnas\InfoPublicSector\H8\PROD\ATTACHMENTS\AM Railroad Crossings\085588H_InspPhotos_20150716.pdf,\\dotnas\InfoPublicSector\H8\PROD\ATTACHMENTS\AM Railroad Crossings\RRX_LOU_Xing_Agrmnt_1988.pdf,\\dotnas\InfoPublicSector\H8\PROD\ATTACHMENTS\AM Railroad Crossings\BNSF_Ordinance_List.pdf,\\dotnas\InfoPublicSector\H8\PROD\ATTACHMENTS\AM Railroad Crossings\NPRR_Ordinance_List.pdf,\\dotnas\InfoPublicSector\H8\PROD\ATTACHMENTS\AM Railroad Crossings\RRX-085588H_InspRec_NoPics_201907.pdf,,,,,6,2023/09/26 19:13:07+00,214.995740439058,-2326.18951734247
1246,764653,16,20267,RRX-101031D,RRX,S HINDS ST BETWEEN EAST MARGINAL ER WAY S AND DEAD END 8 CROSSING 2 TRACKS,RRX-AC/AC,RRX-YARD,0,,,"Hinds St; 2 yard tracks AC/AC POOR - pavement erosion. Tracks combine into 1 north of xing. Xbuck with tape, ENS sign for WB and EB traffic (2 of each in total). Xbuck and tape are bent",RRX-ATGRDE,RRX-PASSVE,INSVC,2019/09/03 00:00:00+00,POOR,2019/09/03 00:00:00+00,BNSF,,2020/05/05 00:00:00+00,,BNSF,,BNSF,,DISTRICT2, ,N,,,,,\\dotnas\InfoPublicSector\H8\PROD\ATTACHMENTS\AM Railroad Crossings\RR_Franchise_Map_Index.pdf,\\dotnas\InfoPublicSector\H8\PROD\ATTACHMENTS\AM Railroad Crossings\RRX_LOU_Xing_Agrmnt_1988.pdf,\\dotnas\InfoPublicSector\H8\PROD\ATTACHMENTS\AM Railroad Crossings\BNSF_Ordinance_List.pdf,\\dotnas\InfoPublicSector\H8\PROD\ATTACHMENTS\AM Railroad Crossings\101031D_InspPhotos_20150721.pdf,\\dotnas\InfoPublicSector\H8\PROD\ATTACHMENTS\AM Railroad Crossings\NPRR_Ordinance_List.pdf,\\dotnas\InfoPublicSector\H8\PROD\ATTACHMENTS\AM Railroad Crossings\RRX-101031D_InspectRecord_20190903.pdf,,,,,6,2023/09/26 19:13:07+00,137.483739726036,-1124.24355941986
1247,764654,16,20378,RRX-101032K,RRX,S HORTON ST BETWEEN EAST MARGINAL ER WAY S AND COLORADO AVE S CROSSING 1 TRACKS,RRX-AC/AC,RRX-YARD,0,,,"Horten St; 1 yard track AC/AC GOOD - clean, few gravel. 2 xbucks with tape, 2 ENS signs.",RRX-ATGRDE,RRX-PASSVE,INSVC,2019/09/03 00:00:00+00,FAIR,2019/09/03 00:00:00+00,BNSF,,2020/05/05 00:00:00+00,,BNSF,,BNSF,,DISTRICT2, ,N,,,,,\\dotnas\InfoPublicSector\H8\PROD\ATTACHMENTS\AM Railroad Crossings\RR_Franchise_Map_Index.pdf,\\dotnas\InfoPublicSector\H8\PROD\ATTACHMENTS\AM Railroad Crossings\Index_to_Permits_Horton_St..pdf,\\dotnas\InfoPublicSector\H8\PROD\ATTACHMENTS\AM Railroad Crossings\RRX_LOU_Xing_Agrmnt_1988.pdf,\\dotnas\InfoPublicSector\H8\PROD\ATTACHMENTS\AM Railroad Crossings\BNSF_Ordinance_List.pdf,\\dotnas\InfoPublicSector\H8\PROD\ATTACHMENTS\AM Railroad Crossings\NPRR_Ordinance_List.pdf,\\dotnas\InfoPublicSector\H8\PROD\ATTACHMENTS\AM Railroad Crossings\101032K_InspPhotos_20150721.pdf,\\dotnas\InfoPublicSector\H8\PROD\ATTACHMENTS\AM Railroad Crossings\RRX-101032K_InspectRecord_20190903.pdf,,,,7,2023/09/26 19:13:07+00,120.445677427611,-750.344029361765
1248,764737,16,23530,RRX-096491S,RRX,WEST MARGINAL WAY SW BETWEEN MARGINAL PL SW AND MARGINAL SB PL SW CROSSING 2 TRACKS,RRX-AC/PC,RRX-YARD,0,,,"Florida St; Located where 096194Y should be, may be incorrect ENS sign posted for this location. Most likely xing west of Terminal 5, closed to public access by fencing
2 yard tracks are about 75' apart, AC/PC GOOD. (should be 5 tracks)
Stop sign, W10-1 old fashioned (both are damaged), ENS for WB traffic",RRX-ATGRDE,RRX-PASSVE,INSVC,2019/08/02 00:00:00+00,GOOD,2019/08/02 00:00:00+00,BNSF,,2020/05/05 00:00:00+00,,BNSF,,BNSF,,DISTRICT1, ,N,,,,,\\dotnas\InfoPublicSector\H8\PROD\ATTACHMENTS\AM Railroad Crossings\RR_Franchise_Map_Index.pdf,\\dotnas\InfoPublicSector\H8\PROD\ATTACHMENTS\AM Railroad Crossings\RRX_LOU_Xing_Agrmnt_1988.pdf,\\dotnas\InfoPublicSector\H8\PROD\ATTACHMENTS\AM Railroad Crossings\BNSF_Ordinance_List.pdf,\\dotnas\InfoPublicSector\H8\PROD\ATTACHMENTS\AM Railroad Crossings\RRX-096491S_InspectRecord_20190802.pdf,\\dotnas\InfoPublicSector\H8\PROD\ATTACHMENTS\AM Railroad Crossings\NPRR_Ordinance_List.pdf,,,,,,5,2023/09/26 19:13:07+00,87.888299289784,-510.778704927905
1249,764795,16,9826,RRX-809515C,RRX,CORSON AVE S BETWEEN AIRPORT WAY S AND S CARSTENS PL CROSSING 1 TRACKS,RRX-AC/AC,RRX-YARD,0,,,"Corson Ave S; Performed GEORGETOWN DIAGNOSTIC with UPRR (7/2/19). 1 yard track AC/AC POOR - pavement is very torn up, pieces of wood along tracks. Looks very unkempt. Parking on/near tracks (looks abandoned). More Waste Management trains, 7 days/week. 2 cars nearly got hit by oncoming westbound train . Transition in direction change < 5 mins. Concrete panel would make railroad more visible, add colors. W10-1, xbuck, ENS, pavement marking for NB traffic. ENS sign, W10-1, xbuck, pavement marking for SB traffic. Both markings are faded.",RRX-ATGRDE,RRX-PASSVE,INSVC,2019/07/02 00:00:00+00,POOR,2019/07/02 00:00:00+00,UPRR,,2020/05/05 00:00:00+00,,UPRR,,UPRR,,DISTRICT2, ,N,,,,,\\dotnas\InfoPublicSector\H8\PROD\ATTACHMENTS\AM Railroad Crossings\809515C_InspPhotos_20150721.pdf,\\dotnas\InfoPublicSector\H8\PROD\ATTACHMENTS\AM Railroad Crossings\OR&WA-RR_Ordinance_List.pdf,\\dotnas\InfoPublicSector\H8\PROD\ATTACHMENTS\AM Railroad Crossings\RR_Franchise_Map_Index.pdf,\\dotnas\InfoPublicSector\H8\PROD\ATTACHMENTS\AM Railroad Crossings\RRX-809515C_InspectRecord_20190702.pdf,\\dotnas\InfoPublicSector\H8\PROD\ATTACHMENTS\AM Railroad Crossings\RRX_LOU_Xing_Agrmnt_1988.pdf,\\dotnas\InfoPublicSector\H8\PROD\ATTACHMENTS\AM Railroad Crossings\CM&SPRR_Ordinance_List.pdf,\\dotnas\InfoPublicSector\H8\PROD\ATTACHMENTS\AM Railroad Crossings\UPRR_Ordinance_List.pdf,,,,7,2023/09/26 19:13:07+00,126.378085796805,-819.794391547633
1250,764796,16,19591,RRX-809516J,RRX,S CARSTENS PL BETWEEN CORSON AVE S AND AIRPORT WAY S CROSSING 1 TRACKS,RRX-AC/AC,RRX-YARD,0,,,"S Carstens Place; Performed GEORGETOWN DIAGNOSTIC with UPRR (7/2/19). 1 yard track AC/AC POOR - large holes in pavement. 2 xbucks with tape, 2 ENS signs. People drive on tracks because there’s no indication otherwise",RRX-ATGRDE,RRX-PASSVE,INSVC,2019/07/02 00:00:00+00,POOR,2019/07/02 00:00:00+00,UPRR,,2020/05/05 00:00:00+00,,UPRR,,UPRR,,DISTRICT2, ,N,,,,,\\dotnas\InfoPublicSector\H8\PROD\ATTACHMENTS\AM Railroad Crossings\OR&WA-RR_Ordinance_List.pdf,\\dotnas\InfoPublicSector\H8\PROD\ATTACHMENTS\AM Railroad Crossings\RR_Franchise_Map_Index.pdf,\\dotnas\InfoPublicSector\H8\PROD\ATTACHMENTS\AM Railroad Crossings\RRX_LOU_Xing_Agrmnt_1988.pdf,\\dotnas\InfoPublicSector\H8\PROD\ATTACHMENTS\AM Railroad Crossings\RRX-809516J_InspectRecord_20190702.pdf,\\dotnas\InfoPublicSector\H8\PROD\ATTACHMENTS\AM Railroad Crossings\CM&SPRR_Ordinance_List.pdf,\\dotnas\InfoPublicSector\H8\PROD\ATTACHMENTS\AM Railroad Crossings\UPRR_Ordinance_List.pdf,\\dotnas\InfoPublicSector\H8\PROD\ATTACHMENTS\AM Railroad Crossings\809516J_InspPhotos_20150722.pdf,,,,7,2023/09/26 19:13:07+00,85.2070179930455,475.825811252401
1251,764639,16,8710,RRX-085589P,RRX,AIRPORT WY S VI BETWEEN AIRPORT N WAY S AND 8TH AVE S CROSSING 1 TRACKS,RRX-BRIDGE,RRX-MAIN,0,,,"Airport Way Bridge over UPRR Argo Yard;  Near Georgetown Diagnostic performed 07/07/2019 with UPRR. Likely City of Seattle Ownership",RRX-UNDER,RRX-NONE,INSVC,2019/07/25 00:00:00+00,GOOD,2019/07/25 00:00:00+00,MULTIPLE,,2020/05/05 00:00:00+00,,MULTIPLE,,MULTIPLE,,DISTRICT2, ,N,,,,,\\dotnas\InfoPublicSector\H8\PROD\ATTACHMENTS\AM Railroad Crossings\RR_Franchise_Map_Index.pdf,\\dotnas\InfoPublicSector\H8\PROD\ATTACHMENTS\AM Railroad Crossings\RRX_LOU_Xing_Agrmnt_1988.pdf,\\dotnas\InfoPublicSector\H8\PROD\ATTACHMENTS\AM Railroad Crossings\BNSF_Ordinance_List.pdf,\\dotnas\InfoPublicSector\H8\PROD\ATTACHMENTS\AM Railroad Crossings\RRX-085589P_InspRec_NoPics_201907.pdf,\\dotnas\InfoPublicSector\H8\PROD\ATTACHMENTS\AM Railroad Crossings\NPRR_Ordinance_List.pdf,\\dotnas\InfoPublicSector\H8\PROD\ATTACHMENTS\AM Railroad Crossings\085589P_InspPhotos_20150721.pdf,,,,,6,2023/09/26 19:13:07+00,824.459218779304,-20144.4886684608
1252,764640,16,20687,RRX-085590J,RRX,S LUCILE ST BR BETWEEN AIRPORT WAY S AND S LUCILE ST CROSSING 1 TRACKS,RRX-BRIDGE,RRX-MAIN,0,,,"Lucile St Bridge; over BNSF South Seattle Intermodal Facility;  Likely WSDOT ownership",RRX-UNDER,RRX-NONE,INSVC,2019/07/25 00:00:00+00,GOOD,2019/07/25 00:00:00+00,MULTIPLE,,2020/05/05 00:00:00+00,,MULTIPLE,,MULTIPLE,,DISTRICT2, ,N,,,,,\\dotnas\InfoPublicSector\H8\PROD\ATTACHMENTS\AM Railroad Crossings\RR_Franchise_Map_Index.pdf,\\dotnas\InfoPublicSector\H8\PROD\ATTACHMENTS\AM Railroad Crossings\RRX_LOU_Xing_Agrmnt_1988.pdf,\\dotnas\InfoPublicSector\H8\PROD\ATTACHMENTS\AM Railroad Crossings\BNSF_Ordinance_List.pdf,\\dotnas\InfoPublicSector\H8\PROD\ATTACHMENTS\AM Railroad Crossings\NPRR_Ordinance_List.pdf,\\dotnas\InfoPublicSector\H8\PROD\ATTACHMENTS\AM Railroad Crossings\085590J_InspPhotos_20150721.pdf,\\dotnas\InfoPublicSector\H8\PROD\ATTACHMENTS\AM Railroad Crossings\RRX-085590J_InspRec_NoPics_201907.pdf,,,,,6,2023/09/26 19:13:07+00,181.436806116552,-1806.26993536291
1253,764641,16,490948,RRX-085591R,RRX,CORSON AV S OFF RP BETWEEN I5 SB AND I5 CORSON AV S OFF RP CROSSING 1 TRACKS,RRX-BRIDGE,RRX-MAIN,0,,,"Corson Ave Off-ramp from I-5;  over BNSF South Seattle Intermodal Facility;  Likely WSDOT ownership",RRX-UNDER,RRX-NONE,INSVC,2019/07/25 00:00:00+00,GOOD,2019/07/25 00:00:00+00,MULTIPLE,,2020/05/05 00:00:00+00,,MULTIPLE,,MULTIPLE,,DISTRICT2, ,N,,,,,\\dotnas\InfoPublicSector\H8\PROD\ATTACHMENTS\AM Railroad Crossings\RR_Franchise_Map_Index.pdf,\\dotnas\InfoPublicSector\H8\PROD\ATTACHMENTS\AM Railroad Crossings\RRX_LOU_Xing_Agrmnt_1988.pdf,\\dotnas\InfoPublicSector\H8\PROD\ATTACHMENTS\AM Railroad Crossings\BNSF_Ordinance_List.pdf,\\dotnas\InfoPublicSector\H8\PROD\ATTACHMENTS\AM Railroad Crossings\RRX-085591R_InspRec_NoPics_201907.pdf,\\dotnas\InfoPublicSector\H8\PROD\ATTACHMENTS\AM Railroad Crossings\NPRR_Ordinance_List.pdf,,,,,,5,2023/09/26 19:13:07+00,121.954940506564,-1082.81696522089
1254,764642,16,490949,RRX-085592X,RRX,CORSON AV S OFF RP BETWEEN I5 CORSON AV S OFF RP AND I5 NB CROSSING 1 TRACKS,RRX-BRIDGE,RRX-MAIN,0,,,"Corson Ave On-ramp to I-5;  over BNSF South Seattle Intermodal Facility;  likely WSDOT ownership",RRX-UNDER,RRX-NONE,INSVC,2019/07/25 00:00:00+00,GOOD,2019/07/25 00:00:00+00,MULTIPLE,,2020/05/05 00:00:00+00,,MULTIPLE,,MULTIPLE,,DISTRICT2, ,N,,,,,\\dotnas\InfoPublicSector\H8\PROD\ATTACHMENTS\AM Railroad Crossings\RR_Franchise_Map_Index.pdf,\\dotnas\InfoPublicSector\H8\PROD\ATTACHMENTS\AM Railroad Crossings\RRX_LOU_Xing_Agrmnt_1988.pdf,\\dotnas\InfoPublicSector\H8\PROD\ATTACHMENTS\AM Railroad Crossings\BNSF_Ordinance_List.pdf,\\dotnas\InfoPublicSector\H8\PROD\ATTACHMENTS\AM Railroad Crossings\NPRR_Ordinance_List.pdf,\\dotnas\InfoPublicSector\H8\PROD\ATTACHMENTS\AM Railroad Crossings\RRX-085592X_InspRec_NoPics_201907.pdf,,,,,,5,2023/09/26 19:13:07+00,108.03209030273,-861.874920835487
1255,764738,16,350536,RRX-096498P,RRX,2ND AVE S BETWEEN DIAGONAL AVE S AND DEAD END 1 CROSSING 1 TRACKS,RRX-AC/PC,RRX-YARD,0,,,"2nd Ave S; PUBLIC; 1 yard track (needs inspection)",RRX-ATGRDE,RRX-PASSVE, ,, ,,BNSF,,2020/05/05 00:00:00+00,,BNSF,,BNSF,,DISTRICT2, ,N,,,,,\\dotnas\InfoPublicSector\H8\PROD\ATTACHMENTS\AM Railroad Crossings\RR_Franchise_Map_Index.pdf,\\dotnas\InfoPublicSector\H8\PROD\ATTACHMENTS\AM Railroad Crossings\RRX-096498P_InspRec_NoPics_201907.pdf,\\dotnas\InfoPublicSector\H8\PROD\ATTACHMENTS\AM Railroad Crossings\RRX_LOU_Xing_Agrmnt_1988.pdf,\\dotnas\InfoPublicSector\H8\PROD\ATTACHMENTS\AM Railroad Crossings\BNSF_Ordinance_List.pdf,\\dotnas\InfoPublicSector\H8\PROD\ATTACHMENTS\AM Railroad Crossings\NPRR_Ordinance_List.pdf,,,,,,5,2023/09/26 19:13:07+00,101.569275298612,-592.757041878143
1256,764739,16,507269,RRX-098991W,RRX,16TH WR AVE SW BETWEEN SW LANDER ST AND KLICKITAT AVE SW CROSSING 2 TRACKS,RRX-AC/PC,RRX-YARD,0,,,"16th Ave SW; Coordinates updated 9/5/19 (located where 096455W should be). 2 yard tracks AC/PC GOOD - some gravel. Tracks run in between Klickitat Ave and 16th Ave. 2 stop signs, 1 xbuck with tape, 1 ENS sign.",RRX-ATGRDE,RRX-PASSVE,INSVC,2019/09/05 00:00:00+00,GOOD,2019/09/05 00:00:00+00,BNSF,,2020/05/05 00:00:00+00,,BNSF,,BNSF,,DISTRICT1, ,N,,,,,\\dotnas\InfoPublicSector\H8\PROD\ATTACHMENTS\AM Railroad Crossings\RR_Franchise_Map_Index.pdf,\\dotnas\InfoPublicSector\H8\PROD\ATTACHMENTS\AM Railroad Crossings\RRX_LOU_Xing_Agrmnt_1988.pdf,\\dotnas\InfoPublicSector\H8\PROD\ATTACHMENTS\AM Railroad Crossings\BNSF_Ordinance_List.pdf,\\dotnas\InfoPublicSector\H8\PROD\ATTACHMENTS\AM Railroad Crossings\NPRR_Ordinance_List.pdf,\\dotnas\InfoPublicSector\H8\PROD\ATTACHMENTS\AM Railroad Crossings\RRX-098991W_InspectRecord_20190905.pdf,,,,,,5,2023/09/26 19:13:07+00,202.269607352665,-2315.54078225415
1257,764740,16,531032,RRX-099007Y,RRX,WEST SEATTLE BR EB BETWEEN W SEA BR EB 4 AV OFF RP AND 1ST AV S OFF RP CROSSING 1 TRACKS,RRX-AC/AC,RRX-INDY,0,,,"Spokane St EB; This xing is the at-grade EB Spokane St plus 3 yard tracks.  BNSF shares rights with UPRR. 1 track AC/AC FAIR - eroded pavement, cracks. 3 xbucks no tape. Active - lights,no gates. Goes through EB and WB traffic",RRX-ATGRDE,RRX-ACTVE,INSVC,2019/07/23 00:00:00+00,FAIR,2019/07/23 00:00:00+00,BNSF,,2020/05/05 00:00:00+00,,BNSF,,BNSF,,DISTRICT2, ,N,,,,,\\dotnas\InfoPublicSector\H8\PROD\ATTACHMENTS\AM Railroad Crossings\RR_Franchise_Map_Index.pdf,\\dotnas\InfoPublicSector\H8\PROD\ATTACHMENTS\AM Railroad Crossings\RRX_LOU_Xing_Agrmnt_1988.pdf,\\dotnas\InfoPublicSector\H8\PROD\ATTACHMENTS\AM Railroad Crossings\099007Y_InspPhotos_20150713.pdf,\\dotnas\InfoPublicSector\H8\PROD\ATTACHMENTS\AM Railroad Crossings\BNSF_Ordinance_List.pdf,\\dotnas\InfoPublicSector\H8\PROD\ATTACHMENTS\AM Railroad Crossings\RRX-099007Y_InspectRecord_20190723.pdf,\\dotnas\InfoPublicSector\H8\PROD\ATTACHMENTS\AM Railroad Crossings\NPRR_Ordinance_List.pdf,,,,,6,2023/09/26 19:13:07+00,167.865927494254,-1789.89571780623
1258,764797,16,20376,RRX-809517R,RRX,S HOMER ST BETWEEN CORSON AVE S AND AIRPORT WAY S CROSSING 1 TRACKS,RRX-AC/AC,RRX-YARD,0,,,"S Homer St; Performed GEORGETOWN DIAGNOSTIC with UPRR (7/2/19). 1 yard track AC/AC FAIR - lots of gravel.  Isolated from major streets. Surrounded by businesses but still drivable. 1 xbuck facing WB traffic, 2 ENS sings underneath. Parked cars between barricade and rails. Casual driving along tracks. Large puddles next to tracks.",RRX-ATGRDE,RRX-PASSVE,INSVC,2019/07/02 00:00:00+00,FAIR,2019/07/02 00:00:00+00,UPRR,,2020/05/05 00:00:00+00,,UPRR,,UPRR,,DISTRICT2, ,N,,,,,\\dotnas\InfoPublicSector\H8\PROD\ATTACHMENTS\AM Railroad Crossings\OR&WA-RR_Ordinance_List.pdf,\\dotnas\InfoPublicSector\H8\PROD\ATTACHMENTS\AM Railroad Crossings\RR_Franchise_Map_Index.pdf,\\dotnas\InfoPublicSector\H8\PROD\ATTACHMENTS\AM Railroad Crossings\RRX_LOU_Xing_Agrmnt_1988.pdf,\\dotnas\InfoPublicSector\H8\PROD\ATTACHMENTS\AM Railroad Crossings\RRX-809517R_InspectRecord_20190702.pdf,\\dotnas\InfoPublicSector\H8\PROD\ATTACHMENTS\AM Railroad Crossings\CM&SPRR_Ordinance_List.pdf,\\dotnas\InfoPublicSector\H8\PROD\ATTACHMENTS\AM Railroad Crossings\UPRR_Ordinance_List.pdf,,,,,6,2023/09/26 19:13:07+00,78.8661280848086,432.772972142207
1259,764798,16,19884,RRX-809518X,RRX,S DORIS ST BETWEEN CORSON AVE S AND AIRPORT WAY S CROSSING 2 TRACKS,RRX-AC/AC,RRX-YARD,0,,,"S Doris St; Performed GEORGETOWN DIAGNOSTIC with UPRR (7/2/19). 2 yard tracks AC/AC POOR - eroded pavement, wooden planks inside tracks. Xbucks, ENS with tape facing WB and EB traffic. Delivery depends on crossing being open. Tracks morph into 1 track north of xing.",RRX-ATGRDE,RRX-PASSVE,INSVC,2019/07/02 00:00:00+00,POOR,2019/07/02 00:00:00+00,UPRR,,2020/05/05 00:00:00+00,,UPRR,,UPRR,,DISTRICT2, ,N,,,,,\\dotnas\InfoPublicSector\H8\PROD\ATTACHMENTS\AM Railroad Crossings\OR&WA-RR_Ordinance_List.pdf,\\dotnas\InfoPublicSector\H8\PROD\ATTACHMENTS\AM Railroad Crossings\RR_Franchise_Map_Index.pdf,\\dotnas\InfoPublicSector\H8\PROD\ATTACHMENTS\AM Railroad Crossings\RRX_LOU_Xing_Agrmnt_1988.pdf,\\dotnas\InfoPublicSector\H8\PROD\ATTACHMENTS\AM Railroad Crossings\CM&SPRR_Ordinance_List.pdf,\\dotnas\InfoPublicSector\H8\PROD\ATTACHMENTS\AM Railroad Crossings\RRX-809518X_InspectRecord_20190702.pdf,\\dotnas\InfoPublicSector\H8\PROD\ATTACHMENTS\AM Railroad Crossings\UPRR_Ordinance_List.pdf,\\dotnas\InfoPublicSector\H8\PROD\ATTACHMENTS\AM Railroad Crossings\809518X_InspPhotos_20150722.pdf,,,,7,2023/09/26 19:13:07+00,96.5407703115909,-562.033040998579
1260,764877,16,11570,RRX-LRT0003,RRX,M L KING JR WR WAY S BETWEEN S TRENTON ST AND S HENDERSON ST CROSSING 2 TRACKS,RRX-PC/PC,RRX-TRNST,0,,,"S Henderson St; Rainier Beach Station is  SOUTH intersxn. W10-7 (LRT approaching) sign, but only NB/SB. Crosswalk timers on east & west ends of Henderson are independent to allow train to run and left turns for cars. 2-ft barrier between tracks and MLK road (south of intersxn). ""Look Both Ways"" sign at crosswalk.",RRX-ATGRDE,RRX-PASSVE,INSVC,2019/12/13 00:00:00+00,GOOD,2019/12/13 00:00:00+00,TRANSIT,,2020/05/05 00:00:00+00,,TRANSIT,,TRANSIT,,DISTRICT2, ,N,,,,,\\dotnas\InfoPublicSector\H8\PROD\ATTACHMENTS\AM Railroad Crossings\RRX-LRT0003_InspectRecord_20191213.pdf,,,,,,,,,,1,2023/09/26 19:13:07+00,307.631057424667,-4908.46457373843
1261,764878,16,11569,RRX-LRT0004,RRX,M L KING JR WR WAY S BETWEEN S CLOVERDALE ST AND S TRENTON ST CROSSING 2 TRACKS,RRX-PC/PC,RRX-TRNST,0,,,"S Trenton Pedestrian; Skewed pedestrian crossing.  MLK + Henderson Trenton intersxn has W10-7 (LRT approaching) sign, but only NB/SB. Cracked pavement where tracks meet crosswalk.",RRX-ATGRDE,RRX-PASSVE,INSVC,2019/12/13 00:00:00+00,GOOD,2019/12/13 00:00:00+00,TRANSIT,,2020/05/05 00:00:00+00,,TRANSIT,,TRANSIT,,DISTRICT2, ,N,,,,,\\dotnas\InfoPublicSector\H8\PROD\ATTACHMENTS\AM Railroad Crossings\RRX-LRT0004_InspectRecord_20191213.pdf,,,,,,,,,,1,2023/09/26 19:13:07+00,238.577621772942,-3211.9094841874
1262,764723,16,13330,RRX-096451U,RRX,WEST SEATTLE BR EB BETWEEN ALASKAN WY VI NB ON RP AND DELRIDGE-W SEATTLE BR EB ON RP CROSSING 2 TRACKS,RRX-AC/RBR,RRX-YARD,0,,,"Klickitat St SW; noted as PUBLIC in FRA, but is PRIVATE road; Coordinates updated 9/5/19. 2 yard tracks. North track is AC/RBR FAIR - some of the rubber is sticking out the ground. South track is AC/PC FAIR - gravel, trash. ENS sign is fallen over. 2 xbuck with tape, 1 stop sign.",RRX-ATGRDE,RRX-PASSVE,INSVC,2019/09/05 00:00:00+00,FAIR,2019/09/05 00:00:00+00,BNSF,,2020/05/05 00:00:00+00,,BNSF,,BNSF,,DISTRICT1,DISTRICT2,N,,,,,\\dotnas\InfoPublicSector\H8\PROD\ATTACHMENTS\AM Railroad Crossings\RR_Franchise_Map_Index.pdf,\\dotnas\InfoPublicSector\H8\PROD\ATTACHMENTS\AM Railroad Crossings\Index_to_Permits_11th Ave_SW.pdf,\\dotnas\InfoPublicSector\H8\PROD\ATTACHMENTS\AM Railroad Crossings\RRX_LOU_Xing_Agrmnt_1988.pdf,\\dotnas\InfoPublicSector\H8\PROD\ATTACHMENTS\AM Railroad Crossings\BNSF_Ordinance_List.pdf,\\dotnas\InfoPublicSector\H8\PROD\ATTACHMENTS\AM Railroad Crossings\RRX-096451U_InspectRecord_20190905.pdf,\\dotnas\InfoPublicSector\H8\PROD\ATTACHMENTS\AM Railroad Crossings\096451U_InspPhotos_20150713.pdf,\\dotnas\InfoPublicSector\H8\PROD\ATTACHMENTS\AM Railroad Crossings\NPRR_Ordinance_List.pdf,,,,7,2023/09/26 19:13:07+00,130.371980014384,-1213.54248386569
1263,764724,16,13330,RRX-096452B,RRX,WEST SEATTLE BR EB BETWEEN ALASKAN WY VI NB ON RP AND DELRIDGE-W SEATTLE BR EB ON RP CROSSING 2 TRACKS,RRX-AC/PC,RRX-YARD,0,,,"Klickitat St SW; noted as PUBLIC in FRA, but is PRIVATE road; 2 yard tracks  (needs inspection)",RRX-ATGRDE,RRX-PASSVE,INSVC,2019/12/17 00:00:00+00,GOOD,2019/12/17 00:00:00+00,BNSF,,2020/05/05 00:00:00+00,,BNSF,,BNSF,,DISTRICT1,DISTRICT2,N,,,,,\\dotnas\InfoPublicSector\H8\PROD\ATTACHMENTS\AM Railroad Crossings\RR_Franchise_Map_Index.pdf,\\dotnas\InfoPublicSector\H8\PROD\ATTACHMENTS\AM Railroad Crossings\RRX_LOU_Xing_Agrmnt_1988.pdf,\\dotnas\InfoPublicSector\H8\PROD\ATTACHMENTS\AM Railroad Crossings\BNSF_Ordinance_List.pdf,\\dotnas\InfoPublicSector\H8\PROD\ATTACHMENTS\AM Railroad Crossings\NPRR_Ordinance_List.pdf,\\dotnas\InfoPublicSector\H8\PROD\ATTACHMENTS\AM Railroad Crossings\RRX-096452B_InspRec_NoPics_201907.pdf,,,,,,5,2023/09/26 19:13:07+00,170.481804343952,-2023.44507400022
1264,764725,16,22809,RRX-096453H,RRX,SW SPOKANE ST BETWEEN 11TH CR AVE SW AND SW SPOKANE E BR CROSSING 2 TRACKS,RRX-BRIDGE,RRX-YARD,0,,,"Spokane St Bridge at Terminal/Harbor Island;",RRX-UNDER,RRX-NONE,INSVC,2019/12/17 00:00:00+00,GOOD,2019/12/17 00:00:00+00,BNSF,,2020/05/05 00:00:00+00,,MULTIPLE,,MULTIPLE,,DISTRICT1, ,N,,,,,\\dotnas\InfoPublicSector\H8\PROD\ATTACHMENTS\AM Railroad Crossings\RR_Franchise_Map_Index.pdf,\\dotnas\InfoPublicSector\H8\PROD\ATTACHMENTS\AM Railroad Crossings\RRX_LOU_Xing_Agrmnt_1988.pdf,\\dotnas\InfoPublicSector\H8\PROD\ATTACHMENTS\AM Railroad Crossings\Index_to_Permits_13th Ave_SW.pdf,\\dotnas\InfoPublicSector\H8\PROD\ATTACHMENTS\AM Railroad Crossings\BNSF_Ordinance_List.pdf,\\dotnas\InfoPublicSector\H8\PROD\ATTACHMENTS\AM Railroad Crossings\096453H_InspPhotos_20150713.pdf,\\dotnas\InfoPublicSector\H8\PROD\ATTACHMENTS\AM Railroad Crossings\RRX-096453H_InspRec_NoPics_201907.pdf,\\dotnas\InfoPublicSector\H8\PROD\ATTACHMENTS\AM Railroad Crossings\NPRR_Ordinance_List.pdf,,,,7,2023/09/26 19:13:07+00,200.166787942233,-2273.66554738647
1265,764741,16,21311,RRX-099008F,RRX,S SPOKANE NR ST BETWEEN EAST MARGINAL ER WAY S AND COLORADO AVE S CROSSING 2 TRACKS,RRX-BRIDGE,RRX-INDY,0,,,"Spokane St Bridge; this xing is the grade separated xing in the vicinity of 007Y and 009M. 2 tracks AC/PC FAIR - rusty tracks, pavement bits, gravel. Underpass, Active. 1 xbuck on pillar. Lights and gates for EB traffic (needs analysis- distinguish different xings)",RRX-UNDER,RRX-NONE,INSVC,2019/07/23 00:00:00+00,FAIR,2019/07/23 00:00:00+00,BNSF,,2020/05/05 00:00:00+00,,MULTIPLE,,MULTIPLE,,DISTRICT2, ,N,,,,,\\dotnas\InfoPublicSector\H8\PROD\ATTACHMENTS\AM Railroad Crossings\RR_Franchise_Map_Index.pdf,\\dotnas\InfoPublicSector\H8\PROD\ATTACHMENTS\AM Railroad Crossings\Index_to_Permits_Spokane_Ave.pdf,\\dotnas\InfoPublicSector\H8\PROD\ATTACHMENTS\AM Railroad Crossings\RRX_LOU_Xing_Agrmnt_1988.pdf,\\dotnas\InfoPublicSector\H8\PROD\ATTACHMENTS\AM Railroad Crossings\BNSF_Ordinance_List.pdf,\\dotnas\InfoPublicSector\H8\PROD\ATTACHMENTS\AM Railroad Crossings\NPRR_Ordinance_List.pdf,\\dotnas\InfoPublicSector\H8\PROD\ATTACHMENTS\AM Railroad Crossings\099008F_InspPhotos_20150713.pdf,\\dotnas\InfoPublicSector\H8\PROD\ATTACHMENTS\AM Railroad Crossings\RRX-099008F_InspectRecord_20190723.pdf,,,,7,2023/09/26 19:13:07+00,161.408399603128,-1680.65802623405
