Provider,Positive_Cases_Staff,Positive_Cases_Child,Licensed_Capacity,Tier_Level,City,State,Zip_Code,Council_District,ObjectId
Southside Christian Child Care Center #4,2,45,52,"$7,000 ",Louisville,KY,40210,3,1
Southside Christian Child Care #1,2,1,40,"$7,000 ",Louisville,KY,40214,21,2
Southside Christian Child Care Center #3,1,2,99,"$7,000 ",Louisville,KY,40214,25,3
Southside Christian Child Care Center #6,0,0,200,"$11,500 ",Louisville,KY,40272,25,4
Southside Christian Child Care #5,12,6,89,"$7,000 ",Louisville,KY,40203,4,5
Southside Christian Child Care Center #2,0,0,53,"$7,000 ",Louisville,KY,40215,15,6
"J-Town Preschool, Inc.",0,0,219,"$11,500 ",Louisville,KY,40299,20,7
Carriage House Preschool,0,0,90,"$7,000 ",Louisville,KY,40223,17,8
Neighborhood House,0,0,149,"$11,500 ",Louisville,KY,40212,5,9
A Place for Kids,3,2,117,"$11,500 ",Louisville,KY,40219,13,10
Posh Posh Club Child & Family Enrichment Center,0,3,64,"$7,000 ",Louisville,KY,40216,3,11
Sacred Heart Preschool,5,9,343,"$11,500 ",Louisville,KY,40206-3099,9,12
Jewish Community of Louisville,6,4,223,"$11,500 ",Louisville,KY,40205,8,13
"Patches' Playmates, Inc.",2,4,88,"$7,000 ",Louisville,KY,40272,25,14
Southside Christian Child Care Center #10,0,0,90,"$7,000 ",Louisville,KY,40214,25,15
Southside Christian Child Care Center #11,0,2,161,"$11,500 ",Louisville,KY,40218,26,16
Lil Genius Child Care,0,0,99,"$7,000 ",Louisville,KY,40203,4,17
St Paul School,0,0,80,"$7,000 ",Louisville,KY,40258,12,18
"Bright Horizons Children's Centers, LLC",0,0,171,"$11,500 ",Louisville,KY,40202,4,19
"Buttons & Bows Preschool of Louisville, INC, DBA Bluegrass Academy Child Care",24,28,150,"$11,500 ",Louisville,KY,40299,20,20
A to Z Learning Center And Child Care,0,2,57,"$7,000 ",Louisville,KY,40299,22,21
Cornerstone Child Development Center,12,19,165,"$11,500 ",Louisville,KY,40207,9,22
Southside Christian Child Care Center #13,0,0,45,"$7,000 ",Louisville,KY,40272,14,23
Almost Home Infant Daycare,1,0,18,"$3,500 ",Louisville,KY,40299,20,24
Angel house Child Development Center,0,0,96,"$7,000 ",Louisville,KY,40299,20,25
GOOD SPIRIT DEVELOPMENT CENTER,2,0,34,"$7,000 ",Louisville,KY,40210,6,26
READY To LEARN,0,0,62,"$7,000 ",Louisville,KY,40217,15,27
Plainview School,0,0,280,"$11,500 ",Louisville,KY,40223,18,28
My Little Testimonies Child Development Center,0,1,30,"$7,000 ",Louisville,KY,40228,2,29
"Highlands Community Ministries, Inc",3,8,55,"$7,000 ",Louisville,KY,40205,8,30
FunTime Daycare Inc. DBA Honey Bees Daycare ll,1,2,93,"$7,000 ",fairdale,KY,40118,13,31
The Gardner School,2,2,180,"$11,500 ",Louisville,KY,40223,18,32
Trinity House child care,2,2,88,"$7,000 ",Louisville,KY,40211,1,33
Okolona Day Care,2,3,79,"$7,000 ",Louisville,KY,40299,20,34
Farmer Elementary Childcare Program,0,0,99,"$7,000 ",Louisville,KY,40299,20,35
Saint Andrew Academy Preschool and After Care Program,7,11,206,"$11,500 ",Louisville,KY,40258,14,36
Southside Christian Child Care Center #17,0,0,172,"$11,500 ",Louisville,KY,40216,3,37
"Vivid Imaginations Child Care Center, LLC",4,3,76,"$7,000 ",Louisville,KY,40218,10,38
Puzzle's Academy Child Development Center,12,6,300,"$11,500 ",Louisville,KY,40299,11,39
Leaps and Bounds Child Development Center,0,1,50,"$7,000 ",Louisville,KY,40220,11,40
Whiz Kidz Academy,2,8,115,"$11,500 ",Louisville,KY,40299,11,41
OUTER LOOP CHILD CARE,3,11,103,"$11,500 ",Louisville,KY,40219,24,42
Early Learning Campus at University of Louisville,0,0,180,"$11,500 ",Louisville,KY,40208,6,43
Joy-Ti Child Care Center,0,5,49,"$7,000 ",Louisville,KY,40291,22,44
Fresh Anointing Child Development Center,0,3,45,"$7,000 ",Louisville,KY,40215,15,45
Blue Lick Child Care,7,3,99,"$7,000 ",Louisville,KY,40229,24,46
Visually Impaired Preschool Services (VIPS),0,2,49,"$7,000 ",Louisville,KY,40218,10,47
Little Smiles Learning Academy,1,2,45,"$7,000 ",Louisville,KY,40211,1,48
St. Rita School,0,5,58,"$7,000 ",Louisville,KY,40219,24,49
"Valley Child Care, Inc",0,0,180,"$11,500 ",Louisville,KY,40272,25,50
Nee-Nee's Angels Daycare ll,3,0,25,"$7,000 ",Louisville,KY,40212,5,51
Cuddles 2 Cuddles Child Learning center,0,0,33,"$7,000 ",Louisville,KY,40211,5,52
Nur Islamic School of Louisville Early Childhood Center,3,2,90,"$7,000 ",Louisville,KY,40218,10,53
Future Pioneers Learning Center Inc,0,0,99,"$7,000 ",Louisville,KY,40216,3,54
Bright Beginnings Learning Center LLC.,0,0,48,"$7,000 ",Louisville,KY,40216,3,55
Parker O'Neal Inc.  dba MaryAnita Nursery and Preschool,0,5,49,"$7,000 ",Louisville,KY,40216,12,56
Solid Rock -Wee Rock Daycare,0,0,42,"$7,000 ",Louisville,KY,40228-2418,23,57
Leap Frog Academy,1,0,92,"$7,000 ",Louisville,KY,40229,23,58
The Children's Center at Yum! Brands,2,3,70,"$7,000 ",Louisville,KY,40213,10,59
Kids first academy,0,0,33,"$7,000 ",Louisville,KY,40216,12,60
Sproutlings Pediatric Daycare and Preschool,4,16,173,"$11,500 ",Louisville,KY,40041,9,61
Lil Prophets CDC,0,0,41,"$7,000 ",Louisville,KY,40216,3,62
Love and Prayer Childcare,3,9,20,"$7,000 ",Louisville,KY,40203,4,63
"Angel House Child Development Center III, LLC",8,6,141,"$11,500 ",Louisville,KY,40220,26,64
"Precious Moments PreSchool Academy, LLC",2,4,68,"$7,000 ",Louisville,KY,40213,21,65
A Step Ahead Childcare & Learning Center,0,0,78,"$7,000 ",Louisville,KY,40291,23,66
Mac's Childcare III,0,0,103,"$11,500 ",Louisville,KY,40216,1,67
Beautiful Faces Childcare Development Center,0,0,27,"$7,000 ",Louisville,KY,40219,24,68
Small steps childcare,0,1,80,"$7,000 ",Louisville,KY,40218,10,69
The Wright Place Day Care,0,0,29,"$7,000 ",Louisville,KY,40203,4,70
Little Smiles Learning Academy Dumesnil,0,0,64,"$7,000 ",Louisville,KY,40211,1,71
Crown of Jewels Academy II,2,0,97,"$7,000 ",Louisville,KY,40219,2,72
Stony Brook Child Care,1,0,171,"$11,500 ",Louisville,KY,40291,26,73
Zion Christian Preschool,0,3,78,"$7,000 ",Louisville,KY,40217,15,74
Kiddie College of Louisville,0,4,23,"$7,000 ",Louisville,KY,40211,5,75
St. Nicholas Preschool,0,0,60,"$7,000 ",Louisville,KY,40214,25,76
Mac's Creative Kids,4,3,141,"$11,500 ",Louisville,KY,40216,1,77
Active Imaginations Child development Center,6,23,100,"$11,500 ",Louisville,KY,40207,9,78
SUNNYSIDE CHILDCARE,7,8,68,"$7,000 ",Louisville,KY,40216,1,79
Smiling Faces Child Development Center,3,8,70,"$7,000 ",Louisville,KY,40211,5,80
"Kribs2kids Academy Fairdale, LLC",0,0,40,"$7,000 ",Louisville,KY,40207,,81
Southside Christian Child Care Center #15,2,2,78,"$7,000 ",Louisville,KY,40229,,82
Buttons and Giggles Childcare and Learning Center L.L.C.,0,0,51,"$7,000 ",Louisville,KY,40214,13,83
"Primrose School of East Louisville, A and J Learning LLC",15,38,186,"$11,500 ",Louisville,KY,40223,18,84
"Laughter and Lullabies Child Care, LLC",14,36,63,"$7,000 ",Louisville,KY,40291,24,85
Peanut Butter & Jelly Kinder College,3,5,59,"$7,000 ",Louisville,KY,40211,1,86
Talk Childcare To Me L.L.C.,4,2,40,"$7,000 ",Louisville,KY,40216,1,87
BuildingAFutureAcademy,6,31,44,"$7,000 ",Louisville,KY,40213,21,88
Timothy's Angels,0,1,80,"$7,000 ",Louisville,KY,40211,1,89
All God's Children & Mary's Lil Angels,0,4,21,"$7,000 ",Louisville,KY,40218,2,90
Kiddie City Academy,5,3,20,"$7,000 ",Louisville,KY,40210,6,91
KLA Schools of Prospect,6,5,156,"$11,500 ",Prospect,KY,40059,16,92
Theresa's Terrific Kids,12,37,49,"$7,000 ",Louisville,KY,40210,6,93
Gwenniepoohs Childcare,2,3,40,"$7,000 ",Louisville,KY,40210,1,94
Young Nonprofit Foundation,0,0,49,"$7,000 ",Louisville,KY,40299-2840,11,95
"JTown Academy, Inc.",0,0,99,"$7,000 ",Louisville,KY,40299,11,96
St Raphael Archangel School: Pre- Kindergarten,0,2,74,"$7,000 ",Louisville,KY,40205,8,97
Young Kids Academy,0,0,50,"$7,000 ",Louisville,KY,40228,24,98
"Magnolia Montessori, Inc.",1,11,60,"$7,000 ",Louisville,KY,40203,4,99
"MJ & K KIDZ, Inc. dba Building Kidz School",2,12,74,"$7,000 ",Louisville,KY,40245,19,100
Kidz Korner Learning Academy,2,22,90,"$7,000 ",Louisville,KY,40291,22,101
MooMoo's Child Enrichment Center,2,5,20,"$7,000 ",Louisville,KY,40216,3,102
Skillz 4 Life,2,0,125,"$11,500 ",Louisville,KY,40203,4,103
Majestic Scholars Child Care Center,0,3,93,"$7,000 ",Louisville,KY,40211,3,104
"Primrose School at Old Henry Crossing, Almond Joy Corporation",5,7,220,"$11,500 ",Louisville,KY,40245,19,105
Peace of Mind Preschool,0,3,71,"$7,000 ",Louisville,KY,40218,10,106
Best friends Learning Academy,2,4,57,"$7,000 ",Louisville,KY,40216,1,107
Main Street Kids Academy Southwest,0,1,62,"$7,000 ",Louisville,KY,40216,12,108
Latham's Top Learn and  Play,0,5,40,"$7,000 ",Louisville,KY,40214,25,109
"Ready Set Grow Childcare, LLC",3,2,68,"$7,000 ",Louisville,KY,40205,8,110
Gifted Minds Academy Learning Center (2),1,0,49,"$7,000 ",Louisville,KY,40211,4,111
Robbin's Preschool Playhouse and ELC,2,3,43,"$7,000 ",Louisville,KY,40219,24,112
Alisha's little blessings daycare,0,4,16,"$3,500 ",Louisville,KY,40216,12,113
Evangel World Prayer Center dba Meriday Preschool,4,16,115,"$11,500 ",Louisville,KY,40220,26,114
OVEC Newburg Head Start,4,0,108,"$11,500 ",Louisville,KY,40219,2,115
Early Learning Childcare,3,9,126,"$11,500 ",Louisville,KY,40214,25,116
Lyndon Learning Center,8,6,91,"$7,000 ",Louisville,KY,40222,7,117
Auburndale Learning Academy,2,4,69,"$7,000 ",Louisville,KY,40214,25,118
Lodgic Kids Camp,2,1,60,"$7,000 ",Louisville,KY,40202,4,119
Bright Start Childcare and Preschool,0,0,199,"$11,500 ",Louisville,KY,40299,11,120
OVEC Russell Head Start/Early Head Start,1,0,76,"$7,000 ",Louisville,KY,40203,4,121
Developing Young Minds,1,4,82,"$7,000 ",Louisville,KY,40203,6,122
Suga Shane's Learning Center,0,0,26,"$7,000 ",Louisville,KY,40211,5,123
Gifted Minds Academy Learning Center,0,0,34,"$7,000 ",Louisville,KY,40211,4,124
Angel House CDC II,0,0,97,"$7,000 ",Louisville,KY,40214,25,125
Linda Caswell,0,1,6,"$3,500 ",Louisville,KY,40228,24,126
Lisa Bird,0,0,6,"$3,500 ",Louisville,KY,40205,8,127
Cary Hanna,0,2,6,"$3,500 ",Louisville,KY,40242,7,128
Amie Higgs,0,0,6,"$3,500 ",Louisville,KY,40258,12,129
Cyntee's Childcare,0,0,10,"$3,500 ",louisville,KY,40216,3,130
Robert Graves dba Mister Robert's,0,0,10,"$3,500 ",Louisville,KY,40216,3,131
Christine Jackson,2,2,6,"$3,500 ",Louisville,KY,40208,6,132
Glynis Williams,1,0,6,"$3,500 ",Louisville,KY,40219,2,133
Leslie Collins,0,5,6,"$3,500 ",Louisville,KY,40223,17,134
Wanda Alexander,0,2,6,"$3,500 ",Louisville,KY,40212,5,135
Small Footprints Childcare,3,0,13,"$3,500 ",Louisville,KY,40211,5,136
Aja Harris,0,0,6,"$3,500 ",Louisville,KY,40211,1,137
Mary Michelle Pledger,0,9,6,"$3,500 ",Louisville,KY,40228,24,138
Celeste Nichols,0,0,6,"$3,500 ",Louisville,KY,40212,5,139
Yanelis Gonzalez Reyes,2,1,6,"$3,500 ",Louisville,KY,40213,2,140
Wanda Poulter,1,1,6,"$3,500 ",Louisville,KY,40291,22,141
Munchkin Manor Child Enrichment Center,0,0,46,"$7,000 ",Louisville,KY,4021,5,142
"Keystone Learning Academy, Inc.",0,0,120,"$11,500 ",Louisville,KY,40210,6,143
Chestnut Street YMCA Child Care,7,10,364,"$11,500 ",Louisville,KY,40203,4,144
"Highlands Community Ministries, Inc",3,12,83,"$7,000 ",Louisville,KY,40205,8,145
Maple Grove Baptist Day Care Center,3,4,74,"$7,000 ",Louisville,KY,40219,23,146
Ridgewood Child Development Center,0,0,99,"$7,000 ",Louisville,KY,40258,12,147
St Benedict Center for Early education,6,15,160,"$11,500 ",Louisville,KY,40210,4,148
WesKids Child Development Center,5,4,74,"$7,000 ",Louisville,KY,40213,21,149
"Highlands Community Ministries, Inc Eastern Star",8,22,83,"$7,000 ",Louisville,KY,40204,8,150
Temple Trager ECEC,3,10,195,"$11,500 ",Louisville,KY,40241-6000,16,151
"Friends School, Inc.",0,0,136,"$11,500 ",Louisville,KY,40207,26,152
Wee Care Nursery,0,2,100,"$11,500 ",Louisville,KY,40243,19,153
St. Joseph Child Development Center,19,39,185,"$11,500 ",Louisville,KY,40206,9,154
Adath Jeshurun Preschool,4,6,173,"$11,500 ",Louisville,KY,40205,8,155
St. Matthews Area Ministries Child Development Center (St. MAM),6,0,122,"$11,500 ",Louisville,KY,40222,7,156
Olmsted South Middle Childcare Enrichment Program,0,1,99,"$7,000 ",Louisville,KY,40214,21,157
"Beth Haven Baptist Church, Inc.",5,21,227,"$11,500 ",Louisville,KY,40272,14,158
Southwest YMCA Childcare Center,4,7,118,"$11,500 ",Louisville,KY,40214,25,159
First Kids Early Childhood & School Age Care,4,9,127,"$11,500 ",Louisville,KY,40241,16,160
Mosaic CDC,3,4,150,"$11,500 ",Louisville,KY,40258,12,161
Strathmoor Preschool Education Center,5,7,99,"$7,000 ",Louisville,KY,40205,8,162
Second Presbyterian Weekday School,0,0,286,"$11,500 ",Louisville,KY,40207,16,163
Christ Church Preschool and Kindergarten,7,28,400,"$11,500 ",Louisville,KY,40207,7,164
Sonshine House Christian Daycare and Preschool,1,1,225,"$11,500 ",Louisville,KY,40219,24,165
Trinity Presbyterian Preschool,0,0,86,"$7,000 ",Louisville,KY,40223,18,166
Harvey Browne Preschool,8,38,170,"$11,500 ",Louisville,KY,40207,9,167
Highland Presbyterian Church Nursery & Weekday School,0,0,160,"$11,500 ",Louisville,KY,40204,8,168
Smyrna CEP,1,1,153,"$11,500 ",Louisville,KY,40228,23,169
St. Matthews Elementary YMCA SACC,0,0,294,"$11,500 ",Louisville,KY,40207,9,170
S.A.F.E. St. Athanasius After School Care,2,4,174,"$11,500 ",Louisville,KY,40219,24,171
Playworld Child Development,2,1,99,"$7,000 ",Louisville,KY,40228,23,172
Middletown United Methodist Preschool,3,3,126,"$11,500 ",Louisville,KY,40243,19,173
Rainbow Nursery School - Trustees of West Broadway Baptist Church,9,15,107,"$11,500 ",Louisville,KY,40220,26,174
Middletown United Methodist Child Development Center,6,17,113,"$11,500 ",Louisville,KY,40243,19,175
Northeast Family YMCA Child Development Center,6,17,90,"$7,000 ",Louisville,KY,40223,18,176
kid-s-kastle childcare and development center inc.,0,0,222,"$11,500 ",louisville,KY,40245,19,177
Middletown Christian Preschool & Kindergarten,0,0,193,"$11,500 ",Louisville,KY,40243,19,178
YMCA St. Patrick Afterschool Program,0,0,88,"$7,000 ",Louisville,KY,40245,19,179
St. Francis of Assisi Childcare,2,6,93,"$7,000 ",Louisville,KY,40205,8,180
Bright Expectations,0,0,194,"$11,500 ",Louisville,KY,40220,11,181
Zachary Taylor Elementary Childcare Enrichment Program,0,2,100,"$11,500 ",Louisville,KY,40241,17,182
Our Lady of Lourdes Extended Day Program,7,8,132,"$11,500 ",Louisville,KY,40207,9,183
Hite Elementary Childcare Enrichment Program,0,0,99,"$7,000 ",Louisville,KY,40243,19,184
Bright Beginnings Child Development Center,4,5,40,"$7,000 ",Louisville,KY,40219,2,185
MiniVersity Downtown Child Development Center,3,2,126,"$11,500 ",Louisville,KY,40203,4,186
Jeffersontown United Methodist Child Development Center,4,10,100,"$11,500 ",Louisville,KY,40299,11,187
Lil Angels Enrichment Center,1,1,60,"$7,000 ",louisville,KY,40203,4,188
