ID,Type,Story,Parent,Points,Comments,Author,Title,URL,Content,Created
2839651.0,comment,2839345.0,2839443.0,1.0,0,nocipher,,,"It seems sort of silly from a user experience point of view. If you start playing online and then for some reason you can't, you have to start over at the beginning of the game. There's no continuity between your gameplay sessions in that case. And that's really how it has to be if you go with that idea; the alternative is too open to abuse.",1312340214
2839650.0,story,,,1.0,0,asiafoodguide,Asia Food Guide,http://www.1asiafoodguide.com,"Online Magazine Guides You Top A-Z Asian Food Informations! From raw materials to tantalizing Asian foods, we cover all information you ever wanted!",1312340162
2839649.0,comment,2839137.0,2839584.0,9.0,0,adanto6840,,,"I am blown away by how impressive & awesome this is.<p>And that is on both sides of the coin: implementation itself looks to be very solid (Rails, JSONP, yay!) AND the concept itself is amazing to me.  We get 'our' apps (and data) in a format that is open for us to not only use but to contribute to and improve upon!<p>I definitely hope to see more of this type of stuff in the future...",1312340156
2839648.0,comment,2837185.0,2839536.0,1.0,0,woodall,,,"That makes a lot more sense, however, it's not entirely impossible for them to find out what users downloaded the app on that day and only target updates for them; they want out of amazon any way might as well break the TOS. They should be logging some type of 'first_install' after every user pings the server for the first time... but I'm making excuses for Amazon.<p>TBH both parties are at fault. Them for not reading the letter Amazon send WORD FOR WORD and not Amazon for discounting their app to 99cents the day after.",1312340154
2839647.0,story,,,1.0,0,althamax,Toronto real estate,http://www.the-toronto-realestate.com/,"Source of Toronto Real Estate and Toronto Homes for sale.Re-max Real estate agent specializes in Toronto homes, condos,houses.View the latest MLS Listings.",1312340146
2839646.0,story,,,3.0,1,Uncle_Sam,Nginx upstream keepalive: call for testing,http://mailman.nginx.org/pipermail/nginx-devel/2011-July/001057.html,,1312340143
2839645.0,comment,2839438.0,2839438.0,1.0,0,grah4,,,"Seminars about long-term thinking:\n<a href=""http://longnow.org/seminars/"" rel=""nofollow"">http://longnow.org/seminars/</a><p>An incredible series of talks & discussions. The scope of topics covered is akin to TEDtalks. I recommend downloading the entire catalog.<p>edit: itunes audio <a href=""http://itunes.apple.com/podcast/salt-seminars-about-long-term/id186908455"" rel=""nofollow"">http://itunes.apple.com/podcast/salt-seminars-about-long-ter...</a>",1312340112
2839644.0,story,,,1.0,0,hachiya,Major breakthrough claimed in wireless technology,http://www.mercurynews.com/business/ci_18603178,,1312340106
2839643.0,comment,2839345.0,2839361.0,3.0,0,nocipher,,,"Honestly, it was going to happen anyway. D3 is a heavily anticipated title.",1312340056
2839642.0,ntomcme,2837441.0,2839302.0,3.0,0,burgerbrain,,,Privacy and global communication networks create tremendous value for society.  Unfortunetly people want to throw those out for the sake of incidences that negatively effect an <i>astronomically</i> small number of people.,1312339977
2839641.0,comment,2836883.0,2836883.0,1.0,0,jarin,,,"I love this hackery and I'll definitely mess around with it, but in the end it's probably easier just to use the media keys on my keyboard. I don't necessarily feel a huge need for vim to do <i>everything</i>, or I would have switched to emacs instead :)",1312339966
2839640.0,comment,2837185.0,2839460.0,3.0,0,msbarnett,,,"As these developers discovered, all a broader user base brought them was increased infrastructure and support costs, with zero uptick in subsequent sales.<p>""A broader userbase"" that doesn't pay anything isn't ""help"" by any stretch of the imagination for a number of business models.",1312339943
2839639.0,comment,2839581.0,2839581.0,19.0,0,shaggyfrog,,,"Repeat from about two years ago: <a href=""http://news.ycombinator.com/item?id=743860"" rel=""nofollow"">http://news.ycombinator.com/item?id=743860</a><p>I suspect it's not the first time. It's a great story.",1312339918
2839638.0,story,,,1.0,0,abrimo,Jack of all trades and master of problem solving,http://blog.mijura.com/post/8410590257,,1312339883
2839637.0,comment,2836732.0,2836942.0,2.0,0,1amzave,,,"I'm kind of surprised GCC doesn't have a __builtin_* extension for overflow detection.  It seems like a pretty natural fit among a lot of the other ones.<p>...and after a quick bit of googling, it appears this has been discussed by the GCC devs semi-recently: <a href=""http://gcc.gnu.org/bugzilla/show_bug.cgi?id=48580"" rel=""nofollow"">http://gcc.gnu.org/bugzilla/show_bug.cgi?id=48580</a>",1312339883
2839636.0,comment,2839300.0,2839609.0,2.0,0,kaiyu,,,I need to start a company...,1312339876
2839635.0,comment,2839581.0,2839581.0,17.0,0,praeclarum,,,"Reminds me of the Alice Cooper scene from Wayne's World.<p>I was raised to believe that these hedonistic punks knew only sex, drugs, and rock and roll. Learning that they were in fact professionals who intimately knew their craft (and, yeah, also liked to have fun) is a blessing of age.",1312339873
2839634.0,story,,,1.0,1,bobbypage,Faceplanting: an app launch horror story with a twist,,http://taptaptap.com/blog/faceplanting-an-app-launch-horror-story-with-a-twist/,1312339871
2839633.0,comment,2838199.0,2838374.0,3.0,0,ezyang,,,"They're poking fun at the formal methods community, which spends a lot of time doing research in this direction. Percolation of these techniques back to industry has been... less than stellar.",1312339867
,comment,2839345.0,2839590.0,1.0,0,nocipher,,,"The Diablo franchise was never meant to be game with a lot of modding. It was always about a great hack and slash with friends. Since modding was never allowed in online play over Battle.net, the majority of the community never bothered themselves with mods.",1312339752
2839631.0,story,,,1.0,0,panorama,There are a Million Ways to Make a Million Dollars,http://www.kokev.in/2011/07/27/there-are-a-million-ways-to-make-a-million-dollars,,1312339720
2839630.0,comment,2831646.0,2837016.0,3.0,0,jtheory,,,"I hope I didn't seem like I was piling on, and I wasn't annoyed by your post in the first place -- just thinking in terms of the general trend I'd like to see in these threads. Cheers.",1312339709
2839629.0,comment,2839438.0,2839438.0,6.0,0,jordanlev,,,"TechZing is my favorite tech podcast -- two developers chatting about development and startups (mostly on the bootstrapping scale). Sometimes guest interviews with other programmers. If you're a developer you should absolutely check it out, you will most likely love it (especially web developers, especially especially freelancers / people running their own businesses).",1312339667
2839628.0,comment,2839205.0,2839205.0,8.0,0,endian,,,"Nitpick: It's not an apartment, it's a shared lab space near the Marcy Projects. I visited a while back and it was cool.<p>Awesome work, Mark!",1312339631
2839627.0,comment,2838503.0,2838682.0,2.0,0,jasondrowley,,,"Thanks. I've seen Code at my local B&N (and of course, on Amazon), and I've come close to buying it.<p>I'm getting it tomorrow.",1312339613
2839626.0,story,,,1.0,0,lob32sa8,,nau.c:xtp.h/d/wi/iqomtu/n/adsweliiwpxc,,1312339563
2839625.0,comment,2839137.0,2839137.0,4.0,0,drawkbox,,,"I have yearned for a day where government and enterprise systems are simple RESTful/ish, JSON, javascript and HTTP friendly APIs instead of bloated SOAPware... Beautiful simplicity.",1312339523
2839624.0,comment,2838911.0,2839621.0,3.0,0,riboflavin,,,"I guess I would also note that these guys are all kind of headed in the direction of competing with the ""real"" desktop 3D printers, but yeah, they won't be there for a while. I wrote some further thoughts here: <a href=""http://justindunham.net/2011/08/where-is-open-source-3d-printing-going/"" rel=""nofollow"">http://justindunham.net/2011/08/where-is-open-source-3d-prin...</a>",1312339485
2839623.0,comment,2838882.0,2839213.0,5.0,0,grncdr,,,"Very much agree. An extra layer on the danger cake (for web apps) is if your user base grows slowly while keeping the business profitable. Suddenly (sic) you hit real capacity limits after n years, and have <i>no idea</i> how the ""organically grown"" code in question works.",1312339480
2839622.0,comment,2839534.0,2839588.0,4.0,0,bemmu,,,"Nothing wrong with reselling stuff. Also, Mechanical Turk is not available in all countries.",1312339433
2839621.0,comment,2838911.0,2839314.0,2.0,0,riboflavin,,,"I think you can get a ""real"" desktop 3D printer for about $5K these days. But the consumer build-it-yourself designs are doing reasonably well, and actually give very, very good results - the catch is you have to be willing to put a <i>lot</i> of time in.",1312339386
2839620.0,comment,2839345.0,2839552.0,1.0,0,nocipher,,,"Diablo has always had a strong online component. While the series has never been an MMO in a strict sense, online play has always been more engaging (except for rampant spamming... which Blizzard seriously needs to address). Sites like d2jsp.org will attest to the added depth of online play. An economy developed out of the items you could find and there was also high end game play that was only available online. The experience was clearly superior.<p>Lots of people are going to jump all over Blizzard for it, but this move was entirely predictable and makes sense. What do you gain by playing offline: less restrictions and less gameplay. While some people will disagree with me, it is akin to asking for an offline component to WoW or EVE: there's technically a game left, but without other people there's much less fun and enjoyment.",1312339380
2839619.0,comment,2839605.0,2839605.0,1.0,0,efader,,,They will leverage them to innovate on the interface,1312339333
2839618.0,story,,,1.0,0,ruchitg,Terrible experience with Silicon Valley Bank Online banking,,Is it just me or anyone else have find it frustating to use SVB online banking system?,1312339303
2839617.0,comment,2838882.0,2839218.0,2.0,0,ctide,,,"Egotistical engineers always think this time things will be different, because they're smart enough to do it right.  The reality is that every rewrite brings a new and different set of problems that need to be addressed.  You don't escape problems by scrapping it all and starting over and this is one of the most valuable lessons to learn as an engineer.",1312339286
2839616.0,story,,,2.0,0,jabo,The Chrome Web Store Now Has The Google +1 Button For Apps,http://jasonbos.co/the-chrome-web-store-now-has-the-google-1-but,,1312339260
2839615.0,comment,2835212.0,2835542.0,1.0,0,jackfoxy,,,"<a href=""http://www.theamericanscholar.org/the-new-generation/"" rel=""nofollow"">http://www.theamericanscholar.org/the-new-generation/</a>",1312339163
2839614.0,comment,2839322.0,2839322.0,1.0,0,randfish,,,Awesome to meet so many Seattle HN folks. Sorry I had to bail a bit early. Looking forward to potentially hosting the next one at Moz (or Estately if Galen wins the arm wrestling contest) :-),1312339140
2839613.0,story,,,2.0,0,riboflavin,Where is open source 3D printing going?,http://justindunham.net/2011/08/where-is-open-source-3d-printing-going/,,1312339119
2839612.0,comment,2839345.0,2839561.0,0.0,0,zinkem,,,"Or maybe our local gamers have been voting with the paychecks they earn. Patio, I generally think your commentary is valuable and insightful. In this case I think you've reduced a complicated situation to a nifty sounding catch phrase that appeals to our libertarian leanings (even mine).<p>I used to manage a high-volume retail game store (~3m in yearly sales, $30 at a time). Many gamers literally do spend all of their disposable income on the games, and pirate what they cannot afford (and surprise, huge swaths of the gamer population are poor as dirt, and with the amount of time and money they spend on games this isn't changing). This kind of DRM would exist if 1 person or 1million people were pirating games, because its the only secure solution.<p>I don't think this kind of DRM will be successful in improving PC sales in general. The only reason Blizzard gets away with it is because their games will always be at the top of gamer's purchase lists. They are high quality products with a shitload of content and beautiful user interfaces. If every game company followed suite, I don't think the result would be successful.<p>edit, and context: I don't really care what Blizzard does to protect their games. People were concerned about Starcraft 2, the required online connectivity hasn't affected my game experience at all in the last year. I think this will probably be true for D3, as well.",1312339079
2839611.0,comment,2839534.0,2839608.0,1.0,0,dshipper,,,Thanks I hadn't seen that I'll definitely check them out. Do you know if they use MTurk or some other service?,1312339066
2839610.0,comment,2837532.0,2838287.0,2.0,0,logic,,,"Soudan Mine is really quite a sight, if you've never done a mine tour before. If you have any interest at all in the neutrino work happening at Fermilab, be sure to take the scientific tour as well as the tour of the mine proper.",1312339040
2839609.0,comment,2839300.0,2839521.0,1.0,0,camz,,,"Technically, anyone could get away with it.  But, it's the value proposition that really makes it unrealistic lol.<p>You'd have to be at a point where you're trying to scale your business for this type of tax planning to really kick butt.",1312339019
2839608.0,comment,2839534.0,2839534.0,8.0,0,jamesgagan,,,,1312339004
2839606.0,story,,,3.0,1,geekam,Mark C. Miller: Science Reveals Women Who Wear Less Clothing Live Longer,http://www.huffingtonpost.com/mark-c-miller/science-reveals-women-who_b_914511.html,,1312338868
2839605.0,story,,,2.0,1,efader,Facebook's Next Interface,http://www.trendslate.com/2011/08/02/the-future-facebook-interface/,"With the acquisition of Push Pop Press, this provides a glimpse into what is next for Facebook and how they will differentiate themselves yet again from other social networks.",1312338860
2839604.0,story,,,2.0,0,wglb, Proposal for Automated Compiler Bug Reports,http://blog.regehr.org/archives/563,,1312338849
2839603.0,story,,,1.0,0,immortal29,      ,http://www.youtube.asoola.com/3730.html,    <p>    <p>    ,1312338824
2839602.0,comment,2827533.0,1252695.51640053,1.0,0,mikecsh,,,"Yes your'e right that the compiler  != the IDE. The compile time should be attributed to the compiler, of course, but VS has a habit of invoking the compiler unnecessarily, even if no source has changed.<p>I don't really use the WYSIWIG aspects either but <i>all</i> aspects of the UI seem slow and cluttered in my experience. And whether or not you and I use those aspects of the IDE is somewhat immaterial. It is called <i>Visual</i> Studio after all and touts the visual designers.<p>My point regarding the specs of my dev machine were that it is a fairly decent, new machine and the load being placed on it really isn't that high. Comparatively I run XCode on a 4 year old laptop with 2GB RAM, slower disk, slower processor and it is far more responsive. (And FWIW the compiler is faster too, especially now they are using LLVM).<p>When I say the IDE doesn't make a difference to the level of polish you can apply to an application what I'm trying to say is that if you're writing mostly textual code as I do too, then the IDE doesn't really factor into the polish of the application. Although, I suppose I'm contradicting myself as if I'm more productive in XCode then I have more time available to polish, so there is an indirect relationship there :P<p>At the end of the day, they're both decent tools and and everyone will have their preference. My comment was really just because a lot of people have started using XCode in recent years, having moved from VS due to the ""iPhone effect"" and I see an awful lot of comments and posts about how much better VS is, and my experience contradicts that :)",1312338800
2839601.0,story,,,6.0,1,sinzone,Making It Easier for Immigrants to Start Companies in the US - The White House,http://www.whitehouse.gov/blog/2011/08/02/making-it-easier-immigrants-start-companies-united-states,,1312338795
2839600.0,comment,2839205.0,2839511.0,14.0,0,DavidSJ,,,We just don't want it to turn into reddit.,1312338726
2839599.0,comment,2838652.0,2839031.0,1.0,0,igorgue,,,obfuscation != minification != compilation,1312338722
2839598.0,comment,2839205.0,2839205.0,2.0,0,WordSkill,,,"To be remembered down through the ages as the Great Vaporization of Brooklyn, August 3rd, 2011.",1312338718
2839597.0,comment,2838647.0,2839494.0,3.0,0,look_lookatme,,,"Heh, days? If you work from home, try <i>weeks</i>.",1312338708
2839596.0,comment,2837948.0,2839242.0,5.0,0,cheald,,,Procedurally generated assets take very little <i>storage</i>. They still take just as much memory to actually put into the scene graph and render.,1312338685
2839595.0,comment,2839534.0,2839588.0,5.0,0,dshipper,,,"Hey jheriko thanks for the comment! Yes what I'm doing is essentially taking the MTurk service which is for doing a very wide range of tasks, and is also somewhat time consuming to set up, and reselling it as a targeted service for people who want to get their websites reviewed. It's definitely not a scam, just me building a service I thought people might find useful and charging for it. Feel free to email me at dan@danshipper.com, I would love to talk to you more about your thoughts on this.",1312338683
2839594.0,comment,2838652.0,2838996.0,1.0,0,crdoconnor,,,"Remote wipe is a horrible way to implement security on a Dropbox account. Better is client side encryption - although Dropbox has no intention of implementing that either.<p>There are a few other companies that have, however: <a href=""http://skeptu.com/secure-alternatives-to-dropbox"" rel=""nofollow"">http://skeptu.com/secure-alternatives-to-dropbox</a>",1312338672
2839593.0,comment,2839438.0,2839438.0,1.0,0,healsdata,,,"""Back Seat Producers"" for movie recaps and reviews.\n<a href=""http://www.backseatproducers.com/"" rel=""nofollow"">http://www.backseatproducers.com/</a><p>""The Paleo Solution"" for health and nutrition.\n<a href=""http://robbwolf.com/"" rel=""nofollow"">http://robbwolf.com/</a><p>""Manager Tools"" and ""Career Tools"" for general career advice.\n<a href=""http://manager-tools.com/"" rel=""nofollow"">http://manager-tools.com/</a><p>""Jennisodes"" for pen-and-paper RPG interviews.\n<a href=""http://www.jennisodes.com/"" rel=""nofollow"">http://www.jennisodes.com/</a>",1312338648
2839592.0,comment,2837948.0,2839062.0,5.0,0,Klinky,,,"Because they are claiming an increase of detail by a factor of 100,000, while the demo barely showed anything close to a detail increase by a factor of 1.<p>Trees & rocks are often animated in modern games, so animation is important. Additionally there is no point using a heavy duty voxel engine to render background landscapes that no one will visit in the game, especially if it's going to take gobs of RAM & CPU time to do it.<p>Hardware tessellation can already greatly increase surface detail, is already available in modern hardware & has better looking demos.<p><a href=""http://www.youtube.com/watch?v=4G9anRoYGko"" rel=""nofollow"">http://www.youtube.com/watch?v=4G9anRoYGko</a><p><a href=""http://www.youtube.com/watch?v=gT_45RFFTx8"" rel=""nofollow"">http://www.youtube.com/watch?v=gT_45RFFTx8</a><p><a href=""http://www.youtube.com/watch?v=0HWZKGZcKoA"" rel=""nofollow"">http://www.youtube.com/watch?v=0HWZKGZcKoA</a>",1312338584
2839591.0,comment,2839438.0,2839438.0,2.0,0,bemmu,,,"My favorite one is ""The Skeptics' Guide to the Universe"". It has likable hosts and content that is entertaining, but often educational as well.<p>The level of commitment to the show by the Skeptic's Guide hosts is simply amazing. They have been producing great content every week since 2005. I would recommend starting at #108 and make sure you listen to #109 next to see just how committed they are.<p>I usually listen to the show while falling asleep or taking a bike ride.<p>""Planet Money"", ""Radiolab"" and ""The Moth Podcast"" are good too.",1312338557
2839590.0,comment,2839345.0,2839345.0,1.0,0,DanielRibeiro,,,"This is also a great way to prevent a modding community to flourish. The complete oposite of what Notch has been doing with Minecraft: <a href=""http://notch.tumblr.com/post/4955141617/the-plan-for-mods"" rel=""nofollow"">http://notch.tumblr.com/post/4955141617/the-plan-for-mods</a>",1312338472
2839589.0,story,,,2.0,0,geekam,EcoVelo  Blog Archive  Nothing to Fear,http://www.ecovelo.info/2011/08/02/nothing-to-fear/,,1312338451
2839588.0,comment,2839534.0,2839534.0,0.0,0,jheriko,,,"So, if I understand this is essentially reselling Mechanical Turk services with a little work in hiding the details from the customer? I'm not quite sure if this is a scam or not...<p>...but I can think of plenty of cases where people sell ""expertise"" which boils down to the same thing... normally its a bit more complicated than this though. I wonder if the customers would pay if they knew of Amazon's service? My guess is they just don't know about it, or at least didn't think it would be any good for them...",1312338411
2839587.0,comment,2838912.0,2839380.0,2.0,0,jason_tko,,,"Actually, I think he's saying be courteous to people that help you.<p>I agree with this advice, and I think the advice stands alone.<p>I think you should always err on the side of being overly generous to anyone who spends time trying to assist you. So, if he built a startup that makes this process easier, and then writes about it, I think thats great. Whats your beef?",1312338403
2839586.0,comment,2839555.0,2839555.0,1.0,0,sunchild,,,"I've done some work with the 2.0 beta.  It's really easy to drop sproutcore into an embedded panel on an existing application now.  I prefer the eventing conventions in sproutcore over the alternative  purely a matter of preference.  I'm looking forward to the new UI kit, too.",1312338359
2839585.0,comment,2839095.0,2839342.0,1.0,0,a3_nm,,,Anonymity and pseudonimity exist on the Internet. The main problem is that people don't care enough.,1312338358
2839584.0,comment,2839137.0,2839137.0,39.0,0,andrewcarpenter,,,"I'm one of the developers on the Federal Register 2.0 project. Thanks for the great comments; we'd love feedback on how to improve the API or the site in general. In addition to the API client, the whole site is open source and on GitHub: <a href=""https://github.com/criticaljuncture/fr2"" rel=""nofollow"">https://github.com/criticaljuncture/fr2</a>",1312338355
2839583.0,story,,,52.0,8,bruth,IPython 0.11 - Innovation in iPython,http://stronginference.com/weblog/2011/7/15/innovations-in-ipython.html,,1312338317
2839582.0,comment,2839534.0,2839575.0,3.0,0,dshipper,,,This weekend haha I'm not that much of a masochist to do it by hand forever :),1312338237
2839581.0,story,,,182.0,57,pitdesi,Why Van Halen had brown M&Ms contractually removed,http://www.snopes.com/music/artists/vanhalen.asp,,1312338217
2839580.0,story,,,115.0,15,jordanmessina,The Official Ruby Site Is Proudly Maintained by No-One,http://www.rubyinside.com/official-ruby-site-not-so-good-5248.html,,1312338208
2839579.0,comment,2839205.0,2839435.0,2.0,0,sp332,,,"I'm not sure about this one, but I know polywell reactors can be hot enough to use deuterium-deuterium reactions. It's cheaper, easier to extract energy from, and leaves stable helium nuclei with no stray neutrons.",1312338206
2839578.0,comment,2831846.0,2831846.0,0.0,0,damoncali,,,Go to business school. Seriously.,1312338174
2839577.0,comment,2838647.0,2839386.0,2.0,0,hswolff,,,I'd like to know as well but I can attest (from working in NYC) that internet instability is an issue that must be solved.,1312338163
2839576.0,comment,2839469.0,2839554.0,1.0,0,angusgr,,,"Oh wow, I hadn't looked at the price. $119 for the FEZ spider mainboard, and $249 for the starter kit. Education market, I guess?<p>The Netduino is $39 (admittedly, GHIs other smaller ""non-gadgeteer"" FEZ products compete with that), Netduino Plus (ethernet/SD) is $59, but the FEZ does have a ton more features than either.<p>And I guess presumably we can expect more ""gadgeteer clones"" in the next year or so.<p>As for Arduino's market dominance, it seems like suitability/competitiveness really depends on what you want to build. This stuff is several levels up in terms of abstraction and features. Some projects will embrace that, for some it'll just be window dressing.<p>Regarding development tools, TI has a really convenient USB-driven live debugger for their MSP platform, AFAIK including the Launchpad boards. Arduino is still the market leader, despite an absolutely bare-bones (but dead simple) IDE. Maybe Visual Studio tools will tip the balance, I don't know.<p>It'll be an interesting space to watch, that's for sure.",1312338146
2839575.0,comment,2839534.0,2839534.0,6.0,0,pulak,,,"Nice job, Dan. Always rooting for fellow Penn guys :)<p>Do you expect to automate this any time soon?",1312338087
2839574.0,comment,2838194.0,2839219.0,2.0,0,sjs,,,"I'm sure that's one of the larger goals of PyPy, to make idiomatic code that is convenient to write also perform well. They don't have to be mutually exclusive.",1312338069
