ID,Type,Story,Parent,Points,Comments,Author,Title,URL,Content,Created
2839573.0,comment,2837905.0,2839253.0,2.0,0,raganwald,,,"<i>Once you start calling anything an invention, the next logical step is to allow to patent it.</i><p>Invention and Patent-worthy Discovery are not synonymous:<p><pre><code>  An invention is a better or more effective composition,\n  device, or process. An invention may be derived from a\n  pre-existing model or idea, or it could be independently\n  conceived in which case it may be a radical breakthrough...\n\n  An invention that is novel and not obvious to others\n  skilled in the same field may be able to obtain the legal\n  protection of a patent.\n</code></pre>\n<a href=""https://secure.wikimedia.org/wikipedia/en/wiki/Invention"" rel=""nofollow"">https://secure.wikimedia.org/wikipedia/en/wiki/Invention</a><p>It is possible and normal to invent things that are not novel, or may be obvious to others skilled in the same field. Its still invention, it just isnt Big I Invention, its a more modest creative process.<p>Think of it this way: We have the expression re-inventing the wheel. If it wasnt possible to invent things that already exist, it wouldnt be possible to re-invent anything, would it?",1312338069
2839572.0,comment,2837905.0,2838149.0,9.0,0,tmoertel,,,"You wrote that reasonably smart people couldn't figure out the old system, even with a couple of days' investigation.  How is this a good system?  If people can't figure it out, how are they supposed to use it?<p>Then you wrote that, when the new system appeared, ""nearly everyone"" moved to it. Doesn't this suggest that the new system was actually better? Why would most of the old system's clients, for example, pay the price to move to the new system unless they believed it was improved enough to be worth the migration cost?<p>I'm not saying that your conclusions are wrong, just that from reading your anecdote, it's not clear how to reconcile your claim that the rewrite was an mistake with the evidence that the result of that mistake seems to be preferred by nearly everyone who had the choice to keep using the old system.",1312338037
2839571.0,comment,2838894.0,2839551.0,2.0,0,reedlaw,,,check the end of the article,1312338005
2839570.0,comment,2839205.0,2839511.0,-2.0,0,svrocks,,,"well of course, they're changing the world one daily deal at a time. what has nuclear engineering ever done for society?",1312337967
2839569.0,comment,2837532.0,2839383.0,-0.8059715382459729,0,robchez,,,"Design software. Forget the scheduling and geology software, its managed by the big guys.<p>Every mining/mechanical engineer I know uses a collection of spreadsheets they have created/collated. It's cumbersome, its crap, its error prone.<p>* Materials Handling (Conveyor design etc.)<p>* Pumping (Dewatering, supply lines etc.)<p>Other areas which need serious shakeup are drawing and document control. There are junior miners starting every other week and if you can sell your software to them from the beginning to manage there document/drawing control you are set for at least 5-10 years of service/subscripton revenue as well.",1312337955
2839568.0,comment,2835188.0,2836555.0,1.0,0,keeperofdakeys,,,"It has now been marked as a troll, the admin was optimistic too.",1312337899
2839567.0,story,,,1.0,0,armstrong2278,How to Find Unclaimed Money,http://www.youtube.com/watch?v=4ZUbSLHOgnE,The best video explaining the best way to search for unclaimed cash.,1312337878
2839566.0,comment,2839410.0,2839410.0,2.0,0,WoundedMarlin,,,,1312337851
2839565.0,comment,2837532.0,2837532.0,1.0,0,delinquentme,,,"The question is, what will we put our minds to?",1312337805
2839564.0,comment,2838199.0,2839369.0,1.0,0,spambot,,,"I made the comment because Reddit has some bostinnovation.com spammers:\n<a href=""http://www.reddit.com/user/joeymullette"" rel=""nofollow"">http://www.reddit.com/user/joeymullette</a> & <a href=""http://www.reddit.com/user/chezral"" rel=""nofollow"">http://www.reddit.com/user/chezral</a><p>I'm guessing they have employees who just post to social news sites.",1312337795
2839563.0,comment,2838647.0,2839235.0,1.0,0,jeremymims,,,"He means that New York needs a PayPal mafia. I think we already got one with DoubleClick which spawned off an incubator that did Gilt Groupe, 10gen, and Business insider so far. The Lerers are doing their part as well to reinvest in New York. But Chris is right that it won't hurt to have a few more. If Gilt Groupe sells or goes public, I expect we'll see this effect.",1312337791
2839562.0,comment,2838882.0,2839541.0,2.0,0,raldi,,,And that's how New York and Rome and Shanghai grew into world cities. They didn't pave them over and start from scratch. They grew out of shantytowns.,1312337721
2839561.0,comment,2839345.0,2839345.0,4.0,0,patio11,,,"Unworkable DRM: Important bits in client, client secured by key, key handed to client.<p>Workable DRM: Unimportant bits in client, important bits in server, server secured by key, key handed to network operations center.<p>Your local gamers have been voting for this decision with their wallets, for years.",1312337703
2839560.0,comment,2838911.0,2839314.0,2.0,0,hackernewz,,,"If you're willing to spend 10x the amount, you can score a professional printer.  How much is ""many times the amount""?  (p.s. checkout Up! printer)",1312337677
2839559.0,story,,,1.0,0,mohababa,Obat Kutu Air Dari Alam ~ Serambi,http://skripsigratis83.blogspot.com/2011/08/obat-kutu-air-dari-alam.html#.Tjiuwx67CDw.hackernews,,1312337647
9.719493635435771e+306,story,,,1.0,0,pomnebrshoes,Bugaboo Bee,http://www.babybugaboostrollers.com/,,1312337639
2839557.0,comment,2839292.0,2839549.0,1.0,0,duncan_bayne,,,That's amusing - I just logged on to post a comment to the effect of 'that thing looks just like the Millenium Falcon.',1312337599
2839556.0,comment,2838882.0,2839171.0,2.0,0,quink,,,"Without Netscape 6, we wouldn't have had Phoenix/Firebird/Firefox, and probably wouldn't have IE7, IE8, IE9 and KHTML/Webkit would have come about very differently and all these would have had much less competition.<p>Netscape 6, or at least the mere fact that it existed and worked well enough and the fact that it was the first browser ever that did standards well and focused on not much else other than standards, made it the most important browser ever created.<p>Netscape 6 was the most revolutionary browser project ever created and had the development effort behind Netscape 6 not been done, we would possibly have had a much worse very IE-only web today.<p>Never mind that beyond all that, Netscape 4 was terrible and deserved to be thrown out.",1312337577
2839555.0,story,,,66.0,2,bruth,On SproutCore 2.0,http://www.okito.net/post/8409610016/on-sproutcore-2-0,,1312337535
2839554.0,comment,2839469.0,2839548.0,1.0,0,Jarred,,,"If this was the same price as Arduino, this would more than likely change Arduino's market dominance. Microsoft's development tools along with C# makes this much more exciting than most of what Arduino has to offer.",1312337523
2839553.0,story,1982568.9735768484,,2.0,0,Sinaps,While(1) vs for (;;) Is there a speed difference?,http://stackoverflow.com/questions/885908/while-1-vs-for-is-there-a-speed-difference,,1312337445
2839552.0,comment,2839345.0,2839535.0,2.0,0,benologist,,,"There's a big difference between an MMO though ... the online play is the <i>only</i> play, it's not in any sense single player nor would you buy it to play alone or when you're disconnected.<p>With C&C4 it had the single player stuff and the multiplayer stuff just like them all - online play was there and it added lots of value to the game just like it has historically, except they crippled the non-online play by needlessly forcing a constant online connection (if you dropped out you could complete the current game, not save it, not start another), moving your saved games and everything else to their servers etc.",1312337431
2839551.0,comment,2838894.0,2838894.0,1.0,0,clistctrl,,,It's unfortunate there's no mention of using MIMO spatial correlation techniques to increase Performance.,1312337405
2839550.0,story,,,1.0,0,aseponde,eetijivoPe acf rarMFeSg:ear fRrGmxtweilvboe jA itoDtf egPnei oyti t leracewrnn,http://www.cloudbusinessreview.com/2011/08/02/project-drive-review-a-project-management-software-offering-great-flexibility.html,,1312337363
2839549.0,comment,2839292.0,2839292.0,4.694461147279517e+307,0,Eyalush,,,I'm pretty sure I've seen this image circulate the Digg/Reddit cycle a few months ago referring to the Millennium Falcon being found.,1312337255
2839548.0,comment,2839469.0,2839469.0,2.0,0,angusgr,,,"See also <a href=""http://netduino.com/"" rel=""nofollow"">http://netduino.com/</a> for a very similar project that's been around for a while, albeit not with Microsoft sponsoring it.<p>At this point it seems pretty much another ""me-too"" Arduino[1]. The noteworthy fact, I guess, is that it's coming from a major software company not an embedded company this time, and that it's open source hardware/software from Microsoft (OSS libraries not tools/runtime.)<p>Microsoft have been trundling along with .NET microframework/robotics studio/etc for quite a while now, is this a sign of an escalating push into the hobbyist/education/maker space?<p>[1] As per \n<a href=""http://antipastohw.blogspot.com/2010/12/end-of-open-source-hardware-cambrian.html"" rel=""nofollow"">http://antipastohw.blogspot.com/2010/12/end-of-open-source-h...</a>\nSimilar other examples include chipKIT Max32, TI Launchpad.",1312337242
2839547.0,comment,2835212.0,2837268.0,1.0,0,delackner,,,"You are right, Sony manufactures a lot of things in Japan.  But it also manufactures many things (including high end televisions and some of its game consoles) in China.  They are quite coy about disclosing what percentage, so I don't know where you have read the majority come from Japan.",1312337201
2839546.0,story,,,3.0,0,bike_to_work,10 instances of hilarious cross cultural humor,http://mygengo.com/about-us/blog/10-instances-of-hilarious-cross-cultural-humor/,,1312337190
2839545.0,story,,,-0.6589311888811826,0,ps3breakea5,Iphone cases for cheap,http://blog.zol.com.cn/3402/article_3401379.html,,1312337188
2839544.0,comment,2838882.0,2839312.0,1.0,0,fpgeek,,,"To be pedantic, there is at least one fate worse than the Total Death we observed: Total Death + no Gecko.<p>Even though ths external case is stronger, this holds true even from the company's perspective. AOL continued to release Gecko-derived browsers through 2007. They got something from that (even if it was just AIM installs and propping up the fading Netscape brand for other purposes).",1312337181
2839543.0,story,,,1.0,0,jessicauv7,Hdmi wii cables,http://riji.seedit.com/space.php?uid=774860&do=blog&id=563813,,1312337172
2839542.0,comment,2838911.0,2839314.0,1.0,0,Joakal,,,"RepRap is a free desktop 3D printer capable of printing plastic objects: <a href=""http://reprap.org/wiki/Main_Page"" rel=""nofollow"">http://reprap.org/wiki/Main_Page</a><p>The RepRap Project is an initiative aimed at creating a largely self-replicating machine which can be used for rapid prototyping and manufacturing: <a href=""http://www.reddit.com/r/reprap"" rel=""nofollow"">http://www.reddit.com/r/reprap</a><p>Both are different projects, but relate to 3D printing.",1312337165
2839541.0,comment,2838882.0,2839499.0,3.0,0,badclient,,,"Absolutely, as someone who grew up in a city like Mumbai, I know much about shanty towns and from my knowledge of them, they are far from ideal. ie. They are not know for a strong foundation, cleanliness, longevity etc. They are constantly <i>hacked</i> and <i>patched</i> by its residents to ensure basics like protection from rain, electricity and basics like a toilet.",1312337151
2839540.0,comment,2836124.0,2837118.0,1.0,0,ajju,,,"It does seem like great news. Quality of life in India has definitely gotten better. Actually the growing economy has made entrepreneurship more lucrative, allowing folks to make enough money to be in the upper middle class with a startup.<p>The actual mechanics of a startup still seem to be harder than in the U.S. from what my friends who have gone back tell me.",1312337147
2839539.0,mecontm,2838596.0,2838871.0,1.0,0,intellection,,,"Do Downloads work?<p>Is it as powerful?<p>It is not clear you have every advantage git offers: real access requires equal representation in relation to mainstream commands.<p>- Every git project frontpage looks different than ""Downloads"" page.<p>- Downloads page has 2 sentences; new git-command-friendly project homepage has full good README page.<p>- What about revision history?<p>- Can you upload folders/multiples? Says ""Upload a new file""....<p>- Downloads is a sidebutton, not a main tab; it is a button custom-designed differently than every other button on page, uncertain.<p>Differentials?<p>P.S. Concerning title for your same tangent reason",1312337076
2839538.0,comment,2838804.0,2838804.0,1.0,0,thaytan,,,"Thanks, Wingo! These posts are really cool, and doing a great job of explicating some complex beasts.",1312337069
2839537.0,comment,2839137.0,2839137.0,4.0,0,law,,,"Also, the U.S. Government Printing Office makes available bulk data for certain publications in XML format. See <a href=""http://www.gpo.gov/fdsys/bulkdata/"" rel=""nofollow"">http://www.gpo.gov/fdsys/bulkdata/</a> for more information.",1312336975
2839536.0,comment,2837185.0,2838601.0,2.0,0,phreakhead,,,"""You have a >100,000 user base so push an update to the free app so that it now includes ads.""<p>The problem is, the users who got it when it was free got the PAID version, so they can't push an update to the people who got it for free without making all the users who ACTUALLY paid also get ads.<p>They'd also have to add ads to the paid Google Market version, since the Amazon dev agreement requires that you keep app versions synchronized across all app stores. Amazon has basically put them in a position where they can only lose money or piss off their actual paying customers.",1312336923
2839535.0,comment,2839345.0,2839360.0,2.0,0,Skywing,,,"Nobody uses these complaints when the game is called an MMO. Perhaps that's their new take on Diablo? I was a huge fan of Diablo and played it entirely online. I'm not too angry about this, personally.",1312336875
2839534.0,story,,,218.0,86,dshipper,How I Made $350 In Two Days With Three Pages and Some Payment Code,http://dshipper.posterous.com/how-i-made-350-in-two-days-with-three-pages-a,,1312336846
2839533.0,comment,2838882.0,2839379.0,0.0,0,badclient,,,"Yup, but a tent is not a building. And going from a tent to a building requires you to take apart the tent in almost all cases, no?",1312336846
2839532.0,story,,,2.0,0,bootload,First ffmpeg legal threat is trivial,http://www.ffmpeg.org/threat1.png,,1312336834
2839531.0,story,,,2.0,0,hughesey,Google can't even figure out how to get a high PageRank,http://viewdns.info/pagerank/?domain=plus.google.com,,1312336819
2839530.0,comment,2839292.0,2839292.0,1.0,0,gcb,,,"and yet, all pages i see mention swedish tabloids reporting it. no mention of real news outlets.<p>didn't boter to click this as I've clicked several other links elsewhere.",1312336809
2839529.0,comment,2838652.0,2839183.0,4.0,0,sebkomianos,,,And the message of this comment is?,1312336801
